{
  "name": "x402 List",
  "slug": "x402-list",
  "homepage": "https://x402-list.com",
  "description": "Independent x402 service directory with live payment-ready probes and a paid-call verification tier. Lists most of the ForgeMesh fleet.",
  "kind": "directory",
  "status": "live",
  "added_at": "2026-09-11"
}
